{"doc_id": "news_a084694c20990367", "content": "\n=== NEWS ARTICLE ===\nTitle: 14 Penny stocks surged up to 440% in CY25; 6 emerge as multibaggers. Did you own any?\nSource: Economic Times - Markets\nPublished: 2025-12-28 04:38\nRelated Stocks: LT\nCategories: markets\n\nSummary:\nIn CY25, select penny stocks delivered sharp gains of up to 440%, with several emerging as multibaggers, highlighting strong momentum in low-priced micro-cap stocks despite elevated risks.\n\nSentiment: positive\nURL: https://economictimes.indiatimes.com/markets/stocks/news/14-penny-stocks-surged-up-to-440-in-cy25-6-emerge-as-multibaggers-did-you-own-any/slideshow/126212275.cms\n", "doc_type": "news", "symbol": "LT", "source": "Economic Times - Markets", "metadata": "{\"title\": \"14 Penny stocks surged up to 440% in CY25; 6 emerge as multibaggers. Did you own any?\", \"sentiment\": \"positive\", \"symbols\": [\"LT\"], \"url\": \"https://economictimes.indiatimes.com/markets/stocks/news/14-penny-stocks-surged-up-to-440-in-cy25-6-emerge-as-multibaggers-did-you-own-any/slideshow/126212275.cms\"}", "timestamp": 1766942719458}