{"doc_id": "news_ba0309d8f750828e", "content": "\n=== NEWS ARTICLE ===\nTitle: Trading Nifty in the last week of 2025: Levels, flows and the Santa rally question\nSource: Economic Times - Markets\nPublished: 2025-12-28 05:41\nRelated Stocks: General Market News\nCategories: markets\n\nSummary:\nAs hopes of a Santa rally fade, traders will enter the final week of 2025 focused on Nifty\u2019s technical levels, FII positioning and derivatives cues. Analysts see key supports near 26,000, selective sector strength in defence stocks, and tactical buying opportunities in stocks like NBCC and DBL.\n\nSentiment: positive\nURL: https://economictimes.indiatimes.com/markets/stocks/news/trading-nifty-in-the-last-week-of-2025-levels-flows-and-the-santa-rally-question/articleshow/126212597.cms\n", "doc_type": "news", "symbol": "", "source": "Economic Times - Markets", "metadata": "{\"title\": \"Trading Nifty in the last week of 2025: Levels, flows and the Santa rally question\", \"sentiment\": \"positive\", \"symbols\": [], \"url\": \"https://economictimes.indiatimes.com/markets/stocks/news/trading-nifty-in-the-last-week-of-2025-levels-flows-and-the-santa-rally-question/articleshow/126212597.cms\"}", "timestamp": 1766942719398}