{"doc_id": "news_340091aefcb1d082", "content": "\n=== NEWS ARTICLE ===\nTitle: Market outlook: FII trend, monthly expiry among top factors to track this week\nSource: Economic Times - Markets\nPublished: 2025-12-28 03:49\nRelated Stocks: General Market News\nCategories: markets\n\nSummary:\nIndian stock markets are poised for a volatile week ahead, influenced by the December F&O expiry and crucial domestic data releases. Foreign institutional investors continue their selling spree, while global cues and currency movements also demand attention. Experts advise a cautious, stock-specific approach with disciplined risk management as the year concludes.\n\nSentiment: negative\nURL: https://economictimes.indiatimes.com/markets/stocks/news/market-outlook-fii-trend-monthly-expiry-among-top-factors-to-track-this-week/articleshow/126211889.cms\n", "doc_type": "news", "symbol": "", "source": "Economic Times - Markets", "metadata": "{\"title\": \"Market outlook: FII trend, monthly expiry among top factors to track this week\", \"sentiment\": \"negative\", \"symbols\": [], \"url\": \"https://economictimes.indiatimes.com/markets/stocks/news/market-outlook-fii-trend-monthly-expiry-among-top-factors-to-track-this-week/articleshow/126211889.cms\"}", "timestamp": 1766942719507}