{"doc_id": "news_8251b5567f3effe3", "content": "\n=== NEWS ARTICLE ===\nTitle: Zepto files for $1.3 billion IPO confidentially\nSource: Economic Times - Markets\nPublished: 2025-12-28 04:02\nRelated Stocks: General Market News\nCategories: markets\n\nSummary:\nQuick commerce platform Zepto has filed confidential draft papers with SEBI for a $1.3 billion IPO, aiming to raise Rs 11,000 crore in fresh capital. The company, valued at $7 billion, is set to be the youngest venture capital-backed firm to go public, with a potential listing in July-September 2026.\n\nSentiment: neutral\nURL: https://economictimes.indiatimes.com/markets/ipos/fpos/zepto-files-for-1-3-billion-ipo-confidentially/articleshow/126211860.cms\n", "doc_type": "news", "symbol": "", "source": "Economic Times - Markets", "metadata": "{\"title\": \"Zepto files for $1.3 billion IPO confidentially\", \"sentiment\": \"neutral\", \"symbols\": [], \"url\": \"https://economictimes.indiatimes.com/markets/ipos/fpos/zepto-files-for-1-3-billion-ipo-confidentially/articleshow/126211860.cms\"}", "timestamp": 1766942719495}