{"doc_id": "news_6d2b9e4a43d1e686", "content": "\n=== NEWS ARTICLE ===\nTitle: Stocks to buy for long term: From Bharat Forge, BoB to Bajaj Auto\u2014 Nirmal Bang suggests 10 shares for up to 50% returns\nSource: LiveMint - Markets\nPublished: 2025-12-28 03:03\nRelated Stocks: General Market News\nCategories: markets\n\nSummary:\nStocks to buy for the long term: According to Nirmal Bang, several stocks, including Bharat Forge, Bank of Baroda, Bajaj Auto, Paytm, and SRF, show strong bullish patterns. Key support levels are outlined, with expectations for upward price movements in the near term.\n\nSentiment: positive\nURL: https://www.livemint.com/market/stock-market-news/stocks-to-buy-for-long-term-from-bharat-forge-bob-to-bajaj-auto-nirmal-bang-suggests-10-shares-for-up-to-50-returns-11766887377699.html\n", "doc_type": "news", "symbol": "", "source": "LiveMint - Markets", "metadata": "{\"title\": \"Stocks to buy for long term: From Bharat Forge, BoB to Bajaj Auto\\u2014 Nirmal Bang suggests 10 shares for up to 50% returns\", \"sentiment\": \"positive\", \"symbols\": [], \"url\": \"https://www.livemint.com/market/stock-market-news/stocks-to-buy-for-long-term-from-bharat-forge-bob-to-bajaj-auto-nirmal-bang-suggests-10-shares-for-up-to-50-returns-11766887377699.html\"}", "timestamp": 1766942719977}