{"doc_id": "news_3419b304ff1ea90b", "content": "\n=== NEWS ARTICLE ===\nTitle: Hindustan Copper, RVNL, 8 other BSE 500 stocks surge up to 23% past week. Is yours on the list?\nSource: Economic Times - Markets\nPublished: 2025-12-28 04:59\nRelated Stocks: General Market News\nCategories: markets\n\nSummary:\nIndian equities ended a holiday-shortened week with modest gains as benchmark indices consolidated amid mixed global cues and subdued participation. Despite cautious sentiment and FII selling, select BSE 500 stocks delivered strong weekly performances, led by metals, railways and PSU-linked names outperforming the broader market.\n\nSentiment: positive\nURL: https://economictimes.indiatimes.com/markets/stocks/news/hindustan-copper-rvnl-8-other-bse-500-stocks-surge-up-to-23-past-week-is-yours-on-the-list/slideshow/126212500.cms\n", "doc_type": "news", "symbol": "", "source": "Economic Times - Markets", "metadata": "{\"title\": \"Hindustan Copper, RVNL, 8 other BSE 500 stocks surge up to 23% past week. Is yours on the list?\", \"sentiment\": \"positive\", \"symbols\": [], \"url\": \"https://economictimes.indiatimes.com/markets/stocks/news/hindustan-copper-rvnl-8-other-bse-500-stocks-surge-up-to-23-past-week-is-yours-on-the-list/slideshow/126212500.cms\"}", "timestamp": 1766942719434}