{"doc_id": "news_0cb950bc35670ad5", "content": "\n=== NEWS ARTICLE ===\nTitle: 2025: A defining year that reshaped global trade, policy, and capital markets\nSource: Economic Times - Markets\nPublished: 2025-12-28 04:29\nRelated Stocks: General Market News\nCategories: markets\n\nSummary:\n2025 proved a transformative year, marked by the US's assertive 'America First' agenda and escalating global trade tariffs. India responded with significant economic reforms, including tax relief and a GST overhaul, while navigating volatile foreign investment flows. The year concluded with strong GDP growth, low inflation, and supportive monetary policy, positioning India for future resilience.\n\nSentiment: positive\nURL: https://economictimes.indiatimes.com/markets/stocks/news/2025-a-defining-year-that-reshaped-global-trade-policy-and-capital-markets/articleshow/126212125.cms\n", "doc_type": "news", "symbol": "", "source": "Economic Times - Markets", "metadata": "{\"title\": \"2025: A defining year that reshaped global trade, policy, and capital markets\", \"sentiment\": \"positive\", \"symbols\": [], \"url\": \"https://economictimes.indiatimes.com/markets/stocks/news/2025-a-defining-year-that-reshaped-global-trade-policy-and-capital-markets/articleshow/126212125.cms\"}", "timestamp": 1766942719469}