{"doc_id": "news_76541c0dd0201547", "content": "\n=== NEWS ARTICLE ===\nTitle: MCX silver jumps 40% in December alone, gains  \u20b91,53,554 per kg in 8 months; analysts see further upside in 2026\nSource: LiveMint - Markets\nPublished: 2025-12-28 04:02\nRelated Stocks: General Market News\nCategories: markets\n\nSummary:\nSilver prices have soared 175% in a year, driven by supply shortages and increasing industrial demand. Analysts expect continued gains as investment interest rises. The metal's inclusion in critical minerals lists and weakening dollar support prices.&nbsp;\n\nSentiment: positive\nURL: https://www.livemint.com/market/commodities/mcx-silver-jumps-40-in-december-alone-gains-rs-1-53-554-per-kg-in-8-months-analysts-see-further-upside-in-2026-11766833229700.html\n", "doc_type": "news", "symbol": "", "source": "LiveMint - Markets", "metadata": "{\"title\": \"MCX silver jumps 40% in December alone, gains  \\u20b91,53,554 per kg in 8 months; analysts see further upside in 2026\", \"sentiment\": \"positive\", \"symbols\": [], \"url\": \"https://www.livemint.com/market/commodities/mcx-silver-jumps-40-in-december-alone-gains-rs-1-53-554-per-kg-in-8-months-analysts-see-further-upside-in-2026-11766833229700.html\"}", "timestamp": 1766942719963}