{"doc_id": "news_60915a345962850d", "content": "\n=== NEWS ARTICLE ===\nTitle: MCX among 3 stocks to go ex-date for bonus issue, stock split next week. Do you own any?\nSource: Economic Times - Stocks\nPublished: 2025-12-27 11:28\nRelated Stocks: LT\nCategories: stocks\n\nSummary:\nSeveral listed companies have announced corporate actions next week, including face value consolidation, stock splits and bonus issues, which may boost liquidity, affordability and retail interest without altering underlying business fundamentals.\n\nSentiment: neutral\nURL: https://economictimes.indiatimes.com/markets/stocks/news/mcx-among-3-stocks-to-go-ex-date-for-bonus-issue-stock-split-next-week-do-you-own-any/slideshow/126204077.cms\n", "doc_type": "news", "symbol": "LT", "source": "Economic Times - Stocks", "metadata": "{\"title\": \"MCX among 3 stocks to go ex-date for bonus issue, stock split next week. Do you own any?\", \"sentiment\": \"neutral\", \"symbols\": [\"LT\"], \"url\": \"https://economictimes.indiatimes.com/markets/stocks/news/mcx-among-3-stocks-to-go-ex-date-for-bonus-issue-stock-split-next-week-do-you-own-any/slideshow/126204077.cms\"}", "timestamp": 1766942719571}