{"doc_id": "news_0abe5686ac1d81b1", "content": "\n=== NEWS ARTICLE ===\nTitle: Up to 527% gain! 29 SME IPOs that delivered multibagger returns to investors in a rough year\nSource: Economic Times - Markets\nPublished: 2025-12-28 04:56\nRelated Stocks: LT\nCategories: markets\n\nSummary:\nDespite a sharp slowdown in SME IPO performance in 2025, a select group of fundamentally strong stocks delivered multibagger returns, underscoring the growing importance of quality and disciplined stock selection.\n\nSentiment: neutral\nURL: https://economictimes.indiatimes.com/markets/stocks/news/up-to-527-gain-29-sme-ipos-that-delivered-multibagger-returns-to-investors-in-a-rough-year/articleshow/126212303.cms\n", "doc_type": "news", "symbol": "LT", "source": "Economic Times - Markets", "metadata": "{\"title\": \"Up to 527% gain! 29 SME IPOs that delivered multibagger returns to investors in a rough year\", \"sentiment\": \"neutral\", \"symbols\": [\"LT\"], \"url\": \"https://economictimes.indiatimes.com/markets/stocks/news/up-to-527-gain-29-sme-ipos-that-delivered-multibagger-returns-to-investors-in-a-rough-year/articleshow/126212303.cms\"}", "timestamp": 1766942719446}