{"doc_id": "news_d219a12a544d6ea0", "content": "\n=== NEWS ARTICLE ===\nTitle: From rail to tech stocks: These 10 smallcap stocks post up to 35% weekly gains\nSource: Economic Times - Markets\nPublished: 2025-12-28 04:12\nRelated Stocks: General Market News\nCategories: markets\n\nSummary:\nIndian equity markets saw mild profit booking near record highs. However, several smallcap stocks delivered sharp gains this past week. K&R Rail Engineering surged 34.32%. Jupiter Wagons rose 33.60%. Sasken Technologies gained 32.82%. Hindustan Copper and KNR Constructions also saw substantial increases. These stocks bucked the subdued market tone, showcasing strong individual performance.\n\nSentiment: positive\nURL: https://economictimes.indiatimes.com/markets/stocks/news/from-rail-to-tech-stocks-these-10-smallcap-stocks-post-up-to-35-weekly-gains/slideshow/126212092.cms\n", "doc_type": "news", "symbol": "", "source": "Economic Times - Markets", "metadata": "{\"title\": \"From rail to tech stocks: These 10 smallcap stocks post up to 35% weekly gains\", \"sentiment\": \"positive\", \"symbols\": [], \"url\": \"https://economictimes.indiatimes.com/markets/stocks/news/from-rail-to-tech-stocks-these-10-smallcap-stocks-post-up-to-35-weekly-gains/slideshow/126212092.cms\"}", "timestamp": 1766942719482}