{"doc_id": "news_0015a645acdb526f", "content": "\n=== NEWS ARTICLE ===\nTitle: Market Trading Guide: Buy NBCC and Dalmia Bharat on Monday for up to 11% gains. Here\u2019s why\nSource: Economic Times - Markets\nPublished: 2025-12-28 05:35\nRelated Stocks: General Market News\nCategories: markets\n\nSummary:\nIndian equities extended losses for a second straight session as IT, financial and auto stocks weighed on benchmarks, pushing the Nifty below key short-term averages. Amid rising bearish momentum, analysts flagged 26,000 as a crucial support, while recommending NBCC and Dalmia Bharat on technical breakouts.\n\nSentiment: neutral\nURL: https://economictimes.indiatimes.com/markets/stocks/news/market-trading-guide-buy-nbcc-and-dalmia-bharat-on-monday-for-up-to-11-gains-heres-why/articleshow/126212557.cms\n", "doc_type": "news", "symbol": "", "source": "Economic Times - Markets", "metadata": "{\"title\": \"Market Trading Guide: Buy NBCC and Dalmia Bharat on Monday for up to 11% gains. Here\\u2019s why\", \"sentiment\": \"neutral\", \"symbols\": [], \"url\": \"https://economictimes.indiatimes.com/markets/stocks/news/market-trading-guide-buy-nbcc-and-dalmia-bharat-on-monday-for-up-to-11-gains-heres-why/articleshow/126212557.cms\"}", "timestamp": 1766942719411}