{"doc_id": "news_f5784e0c1886db53", "content": "\n=== NEWS ARTICLE ===\nTitle: Broad-based rally in mid, small-caps unlikely in 2026: Pradeep Gupta, Chairman &amp; MD, Anand Rathi Share and Stock Brokers\nSource: LiveMint - Markets\nPublished: 2025-12-28 04:22\nRelated Stocks: General Market News\nCategories: markets\n\nSummary:\nAnand Rathi's Chairman, Pradeep Gupta, shares insights on the Indian stock market, highlighting that 2026 will see earnings-led returns rather than broad-based rallies. He finds domestic cyclicals, such as those linked to capex, manufacturing, and infrastructure, attractive.\n\nSentiment: positive\nURL: https://www.livemint.com/market/stock-market-news/expert-view-broad-based-rallies-in-mid-small-caps-like-the-past-cycle-unlikely-in-2026-says-anand-rathi-chairman-11766895072749.html\n", "doc_type": "news", "symbol": "", "source": "LiveMint - Markets", "metadata": "{\"title\": \"Broad-based rally in mid, small-caps unlikely in 2026: Pradeep Gupta, Chairman &amp; MD, Anand Rathi Share and Stock Brokers\", \"sentiment\": \"positive\", \"symbols\": [], \"url\": \"https://www.livemint.com/market/stock-market-news/expert-view-broad-based-rallies-in-mid-small-caps-like-the-past-cycle-unlikely-in-2026-says-anand-rathi-chairman-11766895072749.html\"}", "timestamp": 1766942719940}