{"doc_id": "news_573d0793ad4c26d5", "content": "\n=== NEWS ARTICLE ===\nTitle: How Sundararaman Ramamurthy rebuilt BSE into a 14x wealth-creation machine in 3 years\nSource: Economic Times - Markets\nPublished: 2025-12-28 05:49\nRelated Stocks: LT\nCategories: markets\n\nSummary:\nBSE has staged a remarkable turnaround since January 2023 under CEO Sundararaman Ramamurthy, driven by cost discipline, tech upgrades and relaunch of equity derivatives. The strategy transformed market share, margins and investor confidence, delivering multi-fold returns and positioning BSE as a serious rival in index options.\n\nSentiment: neutral\nURL: https://economictimes.indiatimes.com/markets/stocks/news/how-sundararaman-ramamurthy-rebuilt-bse-into-a-14x-wealth-creation-machine-in-3-years/articleshow/126212666.cms\n", "doc_type": "news", "symbol": "LT", "source": "Economic Times - Markets", "metadata": "{\"title\": \"How Sundararaman Ramamurthy rebuilt BSE into a 14x wealth-creation machine in 3 years\", \"sentiment\": \"neutral\", \"symbols\": [\"LT\"], \"url\": \"https://economictimes.indiatimes.com/markets/stocks/news/how-sundararaman-ramamurthy-rebuilt-bse-into-a-14x-wealth-creation-machine-in-3-years/articleshow/126212666.cms\"}", "timestamp": 1766942719385}