{"doc_id": "news_bdf5b04d8fc15a8e", "content": "\n=== NEWS ARTICLE ===\nTitle: Vijay Kedia\u2019s Portfolio in CY25: Most stocks slide, 6 drop up to 68% \u2014 Are you impacted?\nSource: Economic Times - Stocks\nPublished: 2025-12-27 09:25\nRelated Stocks: General Market News\nCategories: stocks\n\nSummary:\nAs per the latest available data for the September 2025 quarter, Kedia holds publicly disclosed stakes in around 16 companies, with a combined value of about Rs 1,170 crore as of December 26, 2025, down nearly 38% from Rs 1,896 crore in December 2024.\n\nSentiment: neutral\nURL: https://economictimes.indiatimes.com/markets/stocks/news/vijay-kedias-portfolio-in-cy25-most-stocks-slide-6-drop-up-to-68-are-you-impacted/slideshow/126202807.cms\n", "doc_type": "news", "symbol": "", "source": "Economic Times - Stocks", "metadata": "{\"title\": \"Vijay Kedia\\u2019s Portfolio in CY25: Most stocks slide, 6 drop up to 68% \\u2014 Are you impacted?\", \"sentiment\": \"neutral\", \"symbols\": [], \"url\": \"https://economictimes.indiatimes.com/markets/stocks/news/vijay-kedias-portfolio-in-cy25-most-stocks-slide-6-drop-up-to-68-are-you-impacted/slideshow/126202807.cms\"}", "timestamp": 1766942719595}