{"doc_id": "news_9dd4783ed226bba3", "content": "\n=== NEWS ARTICLE ===\nTitle: India set to log record FII outflows as net sale hits Rs 1.58 lakh crore in 2025\nSource: Economic Times - Stocks\nPublished: 2025-12-27 10:14\nRelated Stocks: General Market News\nCategories: stocks\n\nSummary:\nForeign investors are set to record their biggest-ever exit from Indian equities in 2025, with net outflows of over Rs 1.58 lakh crore, driven by exchange selling, rupee weakness and global capital shifts, despite steady domestic flows.\n\nSentiment: neutral\nURL: https://economictimes.indiatimes.com/markets/stocks/news/india-set-to-log-record-fii-outflows-as-net-sale-hits-rs-1-58-lakh-crore-in-2025/articleshow/126203214.cms\n", "doc_type": "news", "symbol": "", "source": "Economic Times - Stocks", "metadata": "{\"title\": \"India set to log record FII outflows as net sale hits Rs 1.58 lakh crore in 2025\", \"sentiment\": \"neutral\", \"symbols\": [], \"url\": \"https://economictimes.indiatimes.com/markets/stocks/news/india-set-to-log-record-fii-outflows-as-net-sale-hits-rs-1-58-lakh-crore-in-2025/articleshow/126203214.cms\"}", "timestamp": 1766942719583}